{"t": "2026-10-07T14:37:37", "kind": "init", "goal": "Get B2's C2 first-try score (5 held-out rule kinds, greedy, no test-time search) to 70% on unseen questions, learning from the night's practice pool, within 5 hours of M1 Pro GPU compute (counted FLOPs), without harming old skills", "branch": "research/get-b2-s-c2-first-try-score-5-held-out-r-20261007-1437"}
{"t": "2026-10-07T15:36:41", "kind": "setup", "cfg": {"seeds": 2, "calib_seeds": 4, "holdout_seeds": 2, "timeout_min": 30.0, "max_trials": 200, "max_hours": 6.5, "deadline": null, "z": 1.0, "early_stop_z": 2.0, "min_delta": 0.0, "holdout_every": 3, "holdout_cap": 12, "fork_every": 5, "refresh_every": 10, "plateau": 8, "explore": 0.2, "max_file_mb": 20.0, "metric": "c2_right", "direction": "max", "dev_cmd": "bash creative/rl/run_eval.sh dev {seed}", "holdout_cmd": "bash creative/rl/run_eval.sh holdout {seed}", "lock": ["creative/rl/eval_c2.py", "creative/rl/refs.py", "creative/rl/make_holdout.py", "creative/rl/run_eval.sh", "creative/rl/remote.py", "creative/data/", "creative/fastsleep.py", "creative/fewshot.py", "creative/programs.py", "creative/sleep.py", "creative/c2_pilot.py", "creative/c2_stones.py", "creative/rules_real.py", "creative/legal.py", "creative/nightchain.py", "custom_io/"], "editable": ["creative/rl/method.py", "creative/rl/m/"], "guards": [{"metric": "chain5_harm", "op": "<=", "rhs": "2", "text": "chain5_harm<=2"}, {"metric": "flops_tf", "op": "<=", "rhs": "10000", "text": "flops_tf<=10000"}]}}
{"t": "2026-10-07T15:38:10", "kind": "reference", "name": "floor", "rec": {"mean": 0.1953, "std": 0.2761959087314655, "n": 2, "metrics": {"c2_right": 0.1953, "chain5_harm": 0.0, "flops_tf": 0.0}, "cmd": "bash creative/rl/run_eval.sh dev {seed} --ref floor"}}
{"t": "2026-10-07T15:42:38", "kind": "reference", "name": "memory", "rec": {"mean": 34.5703, "std": 4.695613291147387, "n": 2, "metrics": {"c2_right": 34.5703, "chain5_harm": 0.0, "flops_tf": 26.5901}, "cmd": "RL_VAST_DIR=/nonexistent RL_THREADS=8 bash creative/rl/run_eval.sh dev {seed} --ref memory"}}
{"t": "2026-10-07T15:49:24", "kind": "reference", "name": "job6", "rec": {"mean": 37.5, "std": 1.6573168737450312, "n": 2, "metrics": {"c2_right": 37.5, "chain5_harm": 0.7, "flops_tf": 63.6968}, "cmd": "bash creative/rl/run_eval.sh dev {seed} --ref job6"}}
{"t": "2026-10-07T16:00:57", "kind": "reference", "name": "ceiling", "rec": {"mean": 45.70315, "std": 1.1048543456039805, "n": 2, "metrics": {"c2_right": 45.70315, "chain5_harm": 1.4, "flops_tf": 51.12025}, "cmd": "bash creative/rl/run_eval.sh dev {seed} --ref ceiling"}}
{"t": "2026-10-07T16:25:07", "kind": "calibrate", "baseline": {"commit": "ad7abad47abeb25452315874315acf15f0e9ab21", "mean": 42.285175, "std": 4.187498153929942, "n": 4, "metrics": {"c2_right": 42.285175, "chain5_harm": 1.35, "flops_tf": 58.745225}, "holdout_mean": 41.552725, "holdout_std": 2.246076087127655, "holdout_n": 4, "t": "2026-10-07T16:25:07"}}
{"t": "2026-10-07T16:37:29", "kind": "trial", "id": 1, "segment": 1, "arm": "literature", "hypothesis": "Execution replay: run every distinct found program (W + chain) on 24 fresh input sets to make new prompts of the same rule (generic filters only); fine-tune 16 visits per record over W + C + replay at batch 512 (reader place ids pre-filled with numpy, same values).", "predict": "up 5 to 15 points, mostly sq_plus, double_add and affine; harm stays under 2", "hyp": "H1", "source": "https://arxiv.org/abs/1912.12345", "override": null, "parent": "ad7abad47abeb25452315874315acf15f0e9ab21", "lines_added": 84, "lines_removed": 1, "patch": ".research/patches/0001-literature.diff", "notes": [], "dev_values": [45.7031, 44.1406], "dev_mean": 44.92185, "dev_std": 1.1048543456039805, "metrics": {"c2_right": 44.92185, "chain5_harm": -0.35, "flops_tf": 367.86635}, "delta": 2.6366749999999968, "outcome": "near-miss", "reason": "+2.6367 is within noise (needs > +3.1769)", "duration_s": 403.727902173996}
{"t": "2026-10-07T16:50:51", "kind": "trial", "id": 2, "segment": 1, "arm": "tune", "hypothesis": "Train 3x longer: 48 visits per W record instead of 16 on W + chain records (batch 64 as before; reader place ids pre-filled, same values).", "predict": "up 2 to 6 points, mostly sq_plus; harm may rise toward 2", "hyp": "H3", "source": null, "override": null, "parent": "ad7abad47abeb25452315874315acf15f0e9ab21", "lines_added": 26, "lines_removed": 1, "patch": ".research/patches/0002-tune.diff", "notes": [], "dev_values": [52.3438, 52.7344], "dev_mean": 52.539100000000005, "dev_std": 0.2761959087314649, "metrics": {"c2_right": 52.539100000000005, "chain5_harm": 0.3, "flops_tf": 139.89915000000002}, "delta": 1.4648249999999976, "fresh": {"values": [42.1875, 45.3125], "mean": 43.75, "metrics": {"c2_right": 43.75, "chain5_harm": -0.09999999999999998, "flops_tf": 110.0068}}, "outcome": "keep", "reason": "screen +10.2539, fresh seeds +1.4648 (threshold +0.0000)", "duration_s": 1362.201694726944, "commit": "99c25b1405697559f747dfa759b9aa2a61eb8416"}
{"t": "2026-10-07T17:12:06", "kind": "trial", "id": 3, "segment": 1, "arm": "bold", "hypothesis": "Bigger sleep: every W and chain record also gets 3 replayed prompts (its program on fresh inputs; keeps the pool's rule mix), and the fine-tune runs at batch 1024 for about 9x the record rows of the incumbent (40 visits per record).", "predict": "up 5 to 12 points over the incumbent (sq_plus, double_add, affine up; square and last_digit hold); flops about 1,200 TF; harm under 2", "hyp": "H14", "source": null, "override": null, "parent": "99c25b1405697559f747dfa759b9aa2a61eb8416", "lines_added": 84, "lines_removed": 3, "patch": ".research/patches/0003-bold.diff", "notes": [], "dev_values": [66.4062, 62.8906], "dev_mean": 64.6484, "dev_std": 2.485904599939426, "metrics": {"c2_right": 64.6484, "chain5_harm": -0.25, "flops_tf": 1194.74085}, "delta": 21.875, "fresh": {"values": [66.7969, 64.4531], "mean": 65.625, "metrics": {"c2_right": 65.625, "chain5_harm": -0.5, "flops_tf": 1164.15535}}, "outcome": "keep", "reason": "screen +20.8984, fresh seeds +21.8750 (threshold +0.0000)", "duration_s": 1180.0766108036041, "commit": "d3ce58a927d321b76b51dce39966b88494e6c8cf"}
{"t": "2026-10-07T17:27:28", "kind": "trial", "id": 4, "segment": 1, "arm": "simplify", "hypothesis": "Simplify: drop the replayed prompts; the same number of batch-1024 updates on W + chain records alone (160 visits per record).", "predict": "down 3 to 10 points (replay adds example-set variety); if not worse beyond noise, the scale alone did it", "hyp": null, "source": null, "override": null, "parent": "d3ce58a927d321b76b51dce39966b88494e6c8cf", "lines_added": 3, "lines_removed": 4, "patch": ".research/patches/0004-simplify.diff", "notes": [], "dev_values": [49.6094], "dev_mean": 49.6094, "dev_std": 0.0, "metrics": {"c2_right": 49.6094, "chain5_harm": -0.5, "flops_tf": 1214.0006}, "delta": -16.0156, "outcome": "discard", "reason": "early stop: first seed -16.0156 below incumbent (noise 2.91)", "duration_s": 294.3182339668274}
{"t": "2026-10-07T17:39:37", "kind": "trial", "id": 5, "segment": 1, "arm": "combine", "hypothesis": "Combine trial 1 (per-program balance) with H14: every distinct found program with fewer than 32 records gets fresh replayed prompts up to 32 (about +1,300 records, mostly a*x+b rules), same 40 visits per record at batch 1024.", "predict": "up 2 to 6 points, from affine (6% -> 15-25%); square and last_digit hold within 3", "hyp": "H1", "source": null, "override": null, "parent": "d3ce58a927d321b76b51dce39966b88494e6c8cf", "lines_added": 34, "lines_removed": 0, "patch": ".research/patches/0005-combine.diff", "notes": ["fork step: branching off the current best with a different arm than 'bold'"], "dev_values": [67.9688, 63.6719], "dev_mean": 65.82035, "dev_std": 3.038367128080477, "metrics": {"c2_right": 65.82035, "chain5_harm": -0.2, "flops_tf": 1538.07525}, "delta": 0.1953500000000048, "outcome": "near-miss", "reason": "+0.1954 is within noise (needs > +2.9239)", "duration_s": 699.7981774806976}
{"t": "2026-10-07T17:56:37", "kind": "trial", "id": 6, "segment": 1, "arm": "tune", "hypothesis": "Tune: 80 visits per record instead of 40 (2x the batch-1024 updates, about 2,400 TF).", "predict": "up 2 to 5 points (sq_plus and double_add keep climbing); harm under 2", "hyp": "H14", "source": null, "override": null, "parent": "d3ce58a927d321b76b51dce39966b88494e6c8cf", "lines_added": 2, "lines_removed": 1, "patch": ".research/patches/0006-tune.diff", "notes": [], "dev_values": [72.2656, 69.1406], "dev_mean": 70.7031, "dev_std": 2.209708691207961, "metrics": {"c2_right": 70.7031, "chain5_harm": -0.6000000000000001, "flops_tf": 2364.8756}, "delta": 7.03125, "fresh": {"values": [70.7031, 74.6094], "mean": 72.65625, "metrics": {"c2_right": 72.65625, "chain5_harm": -0.7, "flops_tf": 2325.5699999999997}}, "outcome": "keep", "reason": "screen +5.0781, fresh seeds +7.0312 (threshold +0.0000)", "duration_s": 1953.2944178581238, "commit": "d0d4251712412a41a9d08d3ff16a402c2bfd0a2b"}
{"t": "2026-10-07T18:29:35", "kind": "confirm", "commit": "d0d4251712412a41a9d08d3ff16a402c2bfd0a2b", "trial": 6, "mean": 72.65625, "n": 2, "verdict": "gain", "final": false}
{"t": "2026-10-07T18:54:21", "kind": "relock", "reason": "Ben's deployed-autonomy rule (10-07 18:45 UTC): methods may no longer use the cached night or the parent's DEV-tuned temperature; base method made compliant (own night, experience-derived replay). Segment 1 closed (non-compliant 72.7%)."}
{"t": "2026-10-07T20:24:39", "kind": "calibrate", "baseline": {"commit": "543d8b878463a2d9f7aa93e165c98b068c5857c4", "mean": 71.1914, "std": 2.218278449609064, "n": 4, "metrics": {"c2_right": 71.1914, "chain5_harm": -1.05, "flops_tf": 2362.642575}, "holdout_mean": 71.7285, "holdout_std": 1.8417112784943632, "holdout_n": 4, "t": "2026-10-07T20:24:39"}}
{"t": "2026-10-07T20:46:46", "kind": "trial", "id": 7, "segment": 2, "arm": "combine", "hypothesis": "Top-up (segment 1 near-miss #5, now compliant): every distinct found program with fewer than 32 records gets replayed prompts up to 32 (about +1,300 records, mostly a*x+b); 80 visits per record at batch 1024.", "predict": "up 1 to 4 points: affine 12-21% -> 25-35%, other kinds within 3 points; about 3,100 TF", "hyp": "H1", "source": null, "override": "Segment 2's only affordable trial (budget left about one); re-tests segment 1's best near-miss (#5 top-up, affine 6->25-31%) at the incumbent's 80 visits", "parent": "543d8b878463a2d9f7aa93e165c98b068c5857c4", "lines_added": 21, "lines_removed": 0, "patch": ".research/patches/0007-combine.diff", "notes": [], "dev_values": [71.0938, 70.3125], "dev_mean": 70.70315, "dev_std": 0.5524625281410508, "metrics": {"c2_right": 70.70315, "chain5_harm": -0.6000000000000001, "flops_tf": 3151.3082}, "delta": -0.48825000000000784, "outcome": "discard", "reason": "-0.4883 vs incumbent", "duration_s": 1290.8986201286316}
