{"t": "2026-09-27T14:45:34", "kind": "init", "goal": "After practising sums and grids, the looping reasoner learns a new kind of puzzle (mazes) from as few examples as possible; compared with a fresh loop and a same-size plain net with the same practice; no caller-given kind labels", "branch": "research/after-practising-sums-and-grids-the-loop-20260927-1445"}
{"t": "2026-09-27T15:03:40", "kind": "setup", "cfg": {"seeds": 2, "calib_seeds": 3, "holdout_seeds": 2, "timeout_min": 45.0, "max_trials": 40, "max_hours": 12.0, "deadline": null, "z": 1.0, "early_stop_z": 2.0, "min_delta": 0.0, "holdout_every": 3, "holdout_cap": 12, "fork_every": 5, "refresh_every": 10, "plateau": 8, "explore": 0.2, "max_file_mb": 20.0, "metric": "maze_auc", "direction": "max", "dev_cmd": "python3 -B scripts/claude_xfer1_bench.py eval --split dev --seed {seed}", "holdout_cmd": "python3 -B scripts/claude_xfer1_bench.py eval --split holdout --seed {seed} --inits pre,fresh", "lock": ["scripts/claude_xfer1_bench.py", "scripts/claude_rsn358a_envs.py", "scripts/claude_rsn358m_maze.py", "scripts/claude_blurt1.py"], "editable": ["scripts/claude_xfer1_net.py", "scripts/claude_xfer1_adapt.py"], "guards": [{"metric": "practice_acc", "op": ">=", "rhs": "baseline-0.05", "text": "practice_acc>=baseline-0.05"}, {"metric": "learn_min", "op": "<=", "rhs": "baseline*2", "text": "learn_min<=baseline*2"}]}}
{"t": "2026-09-27T15:59:03", "kind": "setup", "cfg": {"seeds": 2, "calib_seeds": 3, "holdout_seeds": 2, "timeout_min": 50.0, "max_trials": 40, "max_hours": 12.0, "deadline": null, "z": 1.0, "early_stop_z": 2.0, "min_delta": 0.0, "holdout_every": 3, "holdout_cap": 12, "fork_every": 5, "refresh_every": 10, "plateau": 8, "explore": 0.2, "max_file_mb": 20.0, "metric": "maze_auc", "direction": "max", "dev_cmd": "python3 -B scripts/claude_xfer1_bench.py eval --split dev --seed {seed}", "holdout_cmd": "python3 -B scripts/claude_xfer1_bench.py eval --split holdout --seed {seed} --inits pre,fresh", "lock": ["scripts/claude_xfer1_bench.py", "scripts/claude_rsn358a_envs.py", "scripts/claude_rsn358m_maze.py", "scripts/claude_blurt1.py"], "editable": ["scripts/claude_xfer1_net.py", "scripts/claude_xfer1_adapt.py"], "guards": [{"metric": "practice_acc", "op": ">=", "rhs": "baseline-0.05", "text": "practice_acc>=baseline-0.05"}, {"metric": "learn_min", "op": "<=", "rhs": "baseline*4", "text": "learn_min<=baseline*4"}]}}
{"t": "2026-09-27T16:17:33", "kind": "reference", "name": "fresh-loop", "rec": {"mean": 0.07452366666666667, "std": 0.019773546200247776, "n": 3, "metrics": {"maze_auc": 0.07452366666666667, "learn_min": 5.3947709999999995}, "cmd": "python3 -B scripts/claude_xfer1_bench.py eval --split dev --seed {seed} --inits fresh"}}
{"t": "2026-09-27T16:26:17", "kind": "reference", "name": "plain-practised", "rec": {"mean": 0.22238099999999997, "std": 0.012824193229985275, "n": 3, "metrics": {"maze_auc": 0.22238099999999997, "practice_acc": 0.8383333333333334, "learn_min": 2.714226}, "cmd": "python3 -B scripts/claude_xfer1_bench.py eval --split dev --seed {seed} --arm plain"}}
{"t": "2026-09-27T16:34:49", "kind": "reference", "name": "fresh-plain", "rec": {"mean": 0.16190466666666667, "std": 0.0211931785330406, "n": 3, "metrics": {"maze_auc": 0.16190466666666667, "learn_min": 2.654747}, "cmd": "python3 -B scripts/claude_xfer1_bench.py eval --split dev --seed {seed} --arm plain --inits fresh"}}
{"t": "2026-09-27T17:24:06", "kind": "calibrate", "baseline": {"commit": "07f58ec03228e31fe94bb51045abfaa2a141258a", "mean": 0.204762, "std": 0.011436431829902201, "n": 3, "metrics": {"maze_auc": 0.204762, "practice_acc": 0.9658333333333333, "learn_min": 5.300103666666666}, "holdout_mean": 0.16253966666666667, "holdout_std": 0.017052334190172713, "holdout_n": 3, "t": "2026-09-27T17:24:06"}}
{"t": "2026-09-27T17:43:38", "kind": "trial", "id": 1, "segment": 1, "arm": "literature", "hypothesis": "Loop maze learning: every batch runs 16 rounds with gradient through all 16, loss on rounds 11-16 (replaces random 1-16 rounds with a no-gradient prefix)", "predict": "maze_auc up 0.03-0.08 (full credit assignment through the path-tracing rounds); learn_min about 3x", "hyp": "H1", "source": "https://arxiv.org/abs/2202.05826", "override": null, "parent": "07f58ec03228e31fe94bb51045abfaa2a141258a", "lines_added": 12, "lines_removed": 1, "patch": ".research/patches/0001-literature.diff", "notes": [], "dev_values": [0.160714], "dev_mean": 0.160714, "dev_std": 0.0, "metrics": {"maze_auc": 0.160714, "practice_acc": 0.9825, "learn_min": 18.016044}, "delta": -0.044048000000000004, "outcome": "discard", "reason": "early stop: first seed -0.0440 below incumbent (noise 0.0114)", "duration_s": 1125.4738585948944}
{"t": "2026-09-27T17:50:09", "kind": "trial", "id": 2, "segment": 1, "arm": "tune", "hypothesis": "Maze-phase learning rate 2e-3 (was 1e-3), shared by all arms", "predict": "maze_auc +0.01 to +0.03 (faster early learning); small risk of instability", "hyp": "H11", "source": null, "override": null, "parent": "07f58ec03228e31fe94bb51045abfaa2a141258a", "lines_added": 1, "lines_removed": 1, "patch": ".research/patches/0002-tune.diff", "notes": [], "dev_values": [0.164286], "dev_mean": 0.164286, "dev_std": 0.0, "metrics": {"maze_auc": 0.164286, "practice_acc": 0.9825, "learn_min": 5.378735}, "delta": -0.04047600000000001, "outcome": "discard", "reason": "early stop: first seed -0.0405 below incumbent (noise 0.0114)", "duration_s": 366.72570991516113}
{"t": "2026-09-27T18:19:01", "kind": "trial", "id": 3, "segment": 1, "arm": "bold", "hypothesis": "Loop maze learning with deep supervision (TRM): each batch gets 4 updates; each runs 3 no-gradient + 2 gradient rounds from the state the previous update left (detached), loss on the 2 gradient rounds", "predict": "maze_auc +0.02 to +0.06 (4 updates per example and deeper effective recursion, 20 rounds); learn_min about 2.4x", "hyp": "H2", "source": "https://arxiv.org/abs/2510.04871", "override": null, "parent": "07f58ec03228e31fe94bb51045abfaa2a141258a", "lines_added": 28, "lines_removed": 3, "patch": ".research/patches/0003-bold.diff", "notes": [], "dev_values": [0.321429, 0.300714], "dev_mean": 0.3110715, "dev_std": 0.01464771697227936, "metrics": {"maze_auc": 0.3110715, "practice_acc": 0.9725, "learn_min": 13.336037000000001}, "delta": 0.110238, "fresh": {"values": [0.293571, 0.336429], "mean": 0.315, "metrics": {"maze_auc": 0.315, "practice_acc": 0.95875, "learn_min": 13.936273}}, "outcome": "keep", "reason": "screen +0.1063, fresh seeds +0.1102 (threshold +0.0000)", "duration_s": 4135.574991226196, "commit": "42ae88178f2467a0f363bbec360420502be4dfe1"}
{"t": "2026-09-27T19:29:31", "kind": "trial", "id": 4, "segment": 1, "arm": "simplify", "hypothesis": "Simplify: drop the stop-head loss during maze deep supervision (CE only); answers then mostly come at round 48 or when the practised stop head fires", "predict": "neutral (within +-0.01); fewer lines, slightly less compute", "hyp": "H13", "source": null, "override": null, "parent": "42ae88178f2467a0f363bbec360420502be4dfe1", "lines_added": 3, "lines_removed": 6, "patch": ".research/patches/0004-simplify.diff", "notes": [], "dev_values": [0.372143, 0.347857], "dev_mean": 0.36, "dev_std": 0.017172795287896475, "metrics": {"maze_auc": 0.36, "practice_acc": 0.9725, "learn_min": 13.826136}, "delta": 0.05392849999999999, "fresh": {"values": [0.365714, 0.372143], "mean": 0.3689285, "metrics": {"maze_auc": 0.3689285, "practice_acc": 0.96875, "learn_min": 13.517787}}, "outcome": "keep", "reason": "screen +0.0450, fresh seeds +0.0539 (threshold -0.0169)", "duration_s": 4156.075524091721, "commit": "638fe399647de1a45a0006ac62c4bd48513586d2"}
